{
  "title": "设备健康诊断报告 - 主变压器A相",
  "report_id": "DX-20250126-001",
  "device_name": "主变压器A相",
  "device_model": "SFZ11-240000/220",
  "location": "220kV变电站1号主变室",
  "diagnosis_date": "2025-01-26",
  "data_range": "2024-01-01 至 2024-12-31",
  "health_score": 78,
  "health_status": "警告",
  "risk_level": "中",
  "issue_count": 3,
  "abstract": "根据2024年全年监测数据分析，主变压器A相整体运行状况良好，健康评分为78分。主要问题包括油温偏高、局部放电现象、套管绝缘性能下降。建议加强油温监测、计划安排套管更换，并增加局部放电监测频率。设备目前可继续运行，但需密切监控。",
  "device_basic_info": "主变压器A相为240MVA油浸式电力变压器，额定电压220/35kV，2010年投运，累计运行时间14年。主要参数：短路阻抗14%，空载损耗120kW，负载损耗420kW。油重45吨，总重180吨。",
  "operating_environment": "设备位于室内变电站，环境温度常年控制在20-35℃范围内，相对湿度40-60%。通风系统运行正常，无明显环境污染源。最近一次环境检测符合GB/T 11022标准要求。",
  "maintenance_history": "2023-05-15: 年度大修，更换绝缘油，铁芯紧固。\n2022-11-20: 套管预防性试验，发现绝缘电阻略有下降。\n2021-08-10: 冷却系统维护，更换冷却风扇2台。",
  "monitoring_data_summary": "全年油温监测数据显示，平均油温65℃，峰值达到82℃，高于设计值75℃。油色谱分析总烃含量120ppm，处于正常范围。局部放电监测显示放电量50pC，略超标。负载率平均65%，最大负载率85%。",
  "key_metrics_analysis": "绝缘电阻10000MΩ，介损值0.003，吸收比1.3。油耐压值48kV，含水量8ppm。套管电容值240pF，介损0.0045。各项指标除局部放电外均在正常范围内。",
  "trend_analysis": "油温呈上升趋势，近三个月上升约5℃。局部放电值波动较大，最大值80pC。绝缘电阻缓慢下降，年下降率约5%。油色谱数据稳定，无明显增长趋势。",
  "anomaly_detection": "检测到局部放电异常，放电量超过国标规定的20pC限值。油温超过设计值，持续时间约150小时。套管介损值较上次试验增加15%。",
  "fault_description": "主变压器在满负荷运行时油温偏高，最高达到82℃。局部放电监测显示高压侧绕组存在间歇性放电现象。A相套管绝缘性能下降，介质损耗因数增大。",
  "fault_cause_analysis": "油温偏高原因：冷却效率下降，散热器部分堵塞；环境温度偏高，冷却能力受限。局部放电原因：绕组绝缘老化，局部电场集中。套管绝缘下降原因：长期运行导致绝缘材料老化。",
  "fault_location": "油温问题：冷却系统散热器部位。\n局部放电：高压侧绕组端部。\n套管问题：A相高压套管。",
  "urgent_measures": "1. 立即降低负载率至70%以下。\n2. 清理散热器，恢复冷却效率。\n3. 加强油温监测，每2小时记录一次。\n4. 安装临时局部放电在线监测装置。",
  "maintenance_plan": "1. 计划于2025年3月进行套管更换。\n2. 安排在2025年6月进行绝缘油过滤处理。\n3. 每月进行一次局部放电测试。\n4. 每季度进行一次油色谱分析。",
  "spare_parts_suggestion": "需提前采购A相高压套管1台，型号符合原设计。准备绝缘油500升，用于换油或补油。准备冷却器备件1套。",
  "current_risks": "局部放电可能导致绝缘加速老化，存在击穿风险。油温过高影响绝缘寿命，缩短设备使用年限。套管绝缘下降可能引发闪络事故。",
  "potential_risks": "如果局部放电持续发展，可能在6-12个月内导致绕组绝缘失效。油温长期偏高可能导致油质劣化加速。套管故障可能导致主变压器停运。",
  "risk_control": "加强在线监测，实时跟踪局部放电和油温变化。制定应急预案，确保在故障扩大前及时停运。安排专业技术人员定期巡检。与供应商沟通，确保备件及时到位。",
  "conclusion_and_recommendations": "综合评估，主变压器A相健康评分为78分，处于警告状态。设备目前可继续运行，但需加强监测并按计划进行维护。建议优先处理局部放电和油温偏高问题，按计划更换套管。预计完成维护后设备健康评分可提升至90分以上。",
  "technical_parameters": "额定容量: 240MVA\n额定电压: 220/35kV\n短路阻抗: 14%\n空载损耗: 120kW\n负载损耗: 420kW\n冷却方式: ONAN\n联结组别: YN,d11",
  "related_standards": "GB/T 1094.1-2013 电力变压器 第1部分：总则\nGB/T 1094.3-2017 电力变压器 第3部分：绝缘水平、绝缘试验和外绝缘空气间隙\nGB 50150-2016 电气装置安装工程电气设备交接试验标准\nDL/T 596-1996 电力设备预防性试验规程",
  "diagnosis_method": "本报告基于在线监测数据、预防性试验结果、油色谱分析数据以及设备运行记录进行综合分析。采用多维度评估方法，结合国标要求进行风险判断。"
}
